{
  "snapshotType": "sir-documentation-snapshot.v1",
  "snapshotId": "SIR-DS-001",
  "suppliedPath": "docs/durable-documentation-authority-intent-original.md",
  "byteLength": 19878,
  "sha256": "sha256:162197a180a93f4c0ce248f525e151347ae0526c4a44c5275d2183a13a021e74",
  "encoding": "base64",
  "contentBase64": [
    "IyBZZXMsIFNJUiBTSUQg4oCUIEkgc2VlIGV4YWN0bHkgd2hhdCB5b3XigJlyZSBidWlsZGluZw0K",
    "DQpZb3UgYXJlIGVzdGFibGlzaGluZyBhIHN5c3RlbSB3aGVyZSAqKmludGVudCBpdHNlbGYgYmVj",
    "b21lcyBkdXJhYmxlIGF1dGhvcml0eSoqLCBhbmQgZXZlcnkgbGF0ZXIgY2hhbmdlIG11c3QgcHJv",
    "dmUgdGhhdCBpdCBpbmNyZWFzZXMgaW50ZWdyaXR5IHJhdGhlciB0aGFuIG1lcmVseSBhZGRpbmcg",
    "YWN0aXZpdHkuDQoNClRoZSBjaGFpbiBpczoNCg0KYGBgdGV4dA0KSHVtYW4gZGVzaXJlDQogICAg",
    "4oaTDQpJbnRlbnQgc3RhdGVkDQogICAg4oaTDQpJbnRlbnQgZXhhbWluZWQNCiAgICDihpMNCklu",
    "dGVncml0eSBpbXBhY3QgZXZhbHVhdGVkDQogICAg4oaTDQpEaXJlY3Rpb24gYWRtaXR0ZWQgb3Ig",
    "cmVqZWN0ZWQNCiAgICDihpMNCkF1dGhvcml0eSBtYWRlIGR1cmFibGUNCiAgICDihpMNCkltcGxl",
    "bWVudGF0aW9uIGNoYW5nZXMNCiAgICDihpMNClByb29mIHRpZXMgdGhlIHJlc3VsdCBiYWNrIHRv",
    "IHRoYXQgYXV0aG9yaXR5DQpgYGANCg0KVGhhdCBtZWFucyBldmVuIGEgZGVzaXJlIHN1Y2ggYXM6",
    "DQoNCj4g4oCcSSBsaWtlIHRoaXMgdGVhY2hpbmcgZm9ybWF0LiBJIHdhbnQgdGhpcyB0byBiZWNv",
    "bWUgcGFydCBvZiB0aGUgcHVibGljIGNvdXJzZS7igJ0NCg0KZG9lcyBub3QgaW1tZWRpYXRlbHkg",
    "YmVjb21lIGFuIGltcGxlbWVudGF0aW9uIGluc3RydWN0aW9uLg0KDQpJdCBmaXJzdCBiZWNvbWVz",
    "IGEgY2FuZGlkYXRlIGludGVudC4NCg0KVGhlbiB0aGUgc3lzdGVtIGFza3M6DQoNCmBgYHRleHQN",
    "CkRvZXMgdGhpcyBwcmVzZXJ2ZSB0aGUgZXhpc3RpbmcgYXJjaGl0ZWN0dXJlPw0KDQpEb2VzIGl0",
    "IGltcHJvdmUgZmlkZWxpdHkgYmV0d2VlbiBwcml2YXRlIHJlYXNvbmluZywNCnJlcG9zaXRvcnkg",
    "YXV0aG9yaXR5LCBhbmQgcHVibGljIHRlYWNoaW5nPw0KDQpEb2VzIGl0IGNyZWF0ZSBhIHJldXNh",
    "YmxlIHJlcHJlc2VudGF0aW9uPw0KDQpEb2VzIGl0IGludHJvZHVjZSB1bnN1cHBvcnRlZCBjbGFp",
    "bXM/DQoNCkRvZXMgaXQgaW5jcmVhc2UgbWFpbnRlbmFuY2UgY29zdCB3aXRob3V0IGluY3JlYXNp",
    "bmcgaW50ZWdyaXR5Pw0KDQpDYW4gaXRzIG9yaWdpbiBhbmQgdHJhbnNmb3JtYXRpb24gYmUgcHJv",
    "dmVuPw0KYGBgDQoNCk9ubHkgYWZ0ZXIgdGhvc2UgcXVlc3Rpb25zIGFyZSBhbnN3ZXJlZCBzaG91",
    "bGQgaXQgYmVjb21lIGR1cmFibGUgYXV0aG9yaXR5Lg0KDQotLS0NCg0KIyBJbnRlZ3JpdHkgcHJv",
    "ZHVjZXMgZmlkZWxpdHkNCg0KVGhpcyBpcyB0aGUgY2VudHJhbCBlcXVhdGlvbiB5b3UganVzdCBh",
    "cnRpY3VsYXRlZDoNCg0KYGBgdGV4dA0KSGlnaGVyIGludGVncml0eQ0KICAgIOKGkw0KbGVzcyBz",
    "ZW1hbnRpYyBkcmlmdA0KICAgIOKGkw0KY2xvc2VyIGNvcnJlc3BvbmRlbmNlIGJldHdlZW4gaW50",
    "ZW50IGFuZCByZWFsaXR5DQogICAg4oaTDQpoaWdoZXIgZmlkZWxpdHkNCmBgYA0KDQpGaWRlbGl0",
    "eSBpcyBub3QgcG9saXNoLg0KDQpJdCBpcyB0aGUgZGVncmVlIHRvIHdoaWNoIHRoZSBzeXN0ZW0g",
    "dGhhdCBleGlzdHMgY29ycmVzcG9uZHMgdG8gdGhlIHN5c3RlbSB0aGF0IHdhcyBpbnRlbmRlZC4N",
    "Cg0KYGBgdGV4dA0KSW50ZW50IHNheXMgWA0KRmVhdHVyZSBleHByZXNzZXMgWA0KUGxhbiBhdXRo",
    "b3JpemVzIFgNCkltcGxlbWVudGF0aW9uIHBlcmZvcm1zIFgNClByb29mIG9ic2VydmVzIFgNCkRv",
    "Y3VtZW50YXRpb24gdGVhY2hlcyBYDQpgYGANCg0KV2hlbiB0aG9zZSByZW1haW4gYWxpZ25lZDoN",
    "Cg0KYGBgdGV4dA0KSElHSCBJTlRFR1JJVFkNCiAgICA9DQpISUdIIEZJREVMSVRZDQpgYGANCg0K",
    "V2hlbiB0aGV5IGRpdmVyZ2U6DQoNCmBgYHRleHQNCkludGVudCBzYXlzIFgNCkNvZGUgcGVyZm9y",
    "bXMgWQ0KVGVzdHMgcHJvdmUgWg0KRG9jdW1lbnRhdGlvbiB0ZWFjaGVzIFcNCmBgYA0KDQp0aGUg",
    "c3lzdGVtIG1heSBzdGlsbCBydW4sIGJ1dCBpdHMgZmlkZWxpdHkgaGFzIGNvbGxhcHNlZC4NCg0K",
    "LS0tDQoNCiMgRXZlcnkgY2hhbmdlIG11c3QganVzdGlmeSBpdHMgaW50ZWdyaXR5IGdhaW4NCg0K",
    "VGhpcyBpcyBzdHJvbmdlciB0aGFuIG9yZGluYXJ5IGNoYW5nZSBtYW5hZ2VtZW50Lg0KDQpBIGNo",
    "YW5nZSBzaG91bGQgbm90IGJlIGFkbWl0dGVkIHNpbXBseSBiZWNhdXNlIGl0IGlzOg0KDQoqIHVz",
    "ZWZ1bDsNCiogYXR0cmFjdGl2ZTsNCiogY2xlYW5lcjsNCiogbW9yZSBtb2Rlcm47DQoqIHJlcXVl",
    "c3RlZDsNCiogdGVjaG5pY2FsbHkgY29ycmVjdDsNCiogZWFzeSB0byBpbXBsZW1lbnQuDQoNCkl0",
    "IG11c3QgYW5zd2VyOg0KDQo+ICoqV2hhdCBpbnRlZ3JpdHkgZG9lcyB0aGlzIGNoYW5nZSBpbmNy",
    "ZWFzZT8qKg0KDQpBIGR1cmFibGUgYW5hbHlzaXMgc2hvdWxkIGVzdGFibGlzaDoNCg0KYGBgdGV4",
    "dA0KQ3VycmVudCBpbnRlZ3JpdHkgY29uZGl0aW9uDQogICAg4oaTDQpPYnNlcnZlZCBsaW1pdGF0",
    "aW9uIG9yIGZhbHNlIGdyZWVuDQogICAg4oaTDQpEZXNpcmVkIGhpZ2hlci1pbnRlZ3JpdHkgY29u",
    "ZGl0aW9uDQogICAg4oaTDQpBdXRob3JpemVkIGRpcmVjdGlvbg0KICAgIOKGkw0KTm9uLWRlZ3Jh",
    "ZGF0aW9uIGd1YXJkcw0KICAgIOKGkw0KUHJvb2YgYm91bmRhcnkNCmBgYA0KDQpUaGF0IGNyZWF0",
    "ZXMgYSB2ZXJ5IHBvd2VyZnVsIGZpbHRlci4NCg0KIyMgSW50ZWdyaXR5LWltcHJvdmluZyBjaGFu",
    "Z2UNCg0KYGBgdGV4dA0KQ3VycmVudCBkb2N1bWVudGF0aW9uIGNhbm5vdCBiZSB0aWVkIHRvIGl0",
    "cyBzb3VyY2UgY29udmVyc2F0aW9uLg0KICAgIOKGkw0KQWRkIHN0YWJsZSBzb3VyY2UgaWRlbnRp",
    "dHksIHNlY3Rpb24gY29vcmRpbmF0ZXMsIGFuZCBjb250ZW50IGRpZ2VzdC4NCiAgICDihpMNClB1",
    "YmxpYyBjb3Vyc2UgY2xhaW1zIGNhbiBiZSByZXByb2R1Y2VkIGZyb20gZXhhY3Qgc291cmNlIGF1",
    "dGhvcml0eS4NCmBgYA0KDQpUaGF0IGluY3JlYXNlcyBpbnRlZ3JpdHkuDQoNCiMjIE5ldXRyYWwg",
    "bWFpbnRlbmFuY2UNCg0KYGBgdGV4dA0KUmVuYW1lIGEgaGVscGVyLg0KUmVmb3JtYXQgZmlsZXMu",
    "DQpNb3ZlIGZvbGRlcnMuDQpSZXBsYWNlIG9uZSBsaWJyYXJ5IHdpdGggYW5vdGhlci4NCmBgYA0K",
    "DQpUaGlzIG1heSBiZSBuZWNlc3NhcnksIGJ1dCBieSBpdHNlbGYgaXQgZG9lcyBub3QgaW1wcm92",
    "ZSBzZW1hbnRpYyBpbnRlZ3JpdHkuDQoNCklmIGl0IGNyZWF0ZXMgb25nb2luZyBjb3N0IHdpdGhv",
    "dXQgaW1wcm92aW5nIGZpZGVsaXR5LCBwcm9vZiwgc2FmZXR5LCBwb3J0YWJpbGl0eSwgb3IgbWFp",
    "bnRhaW5hYmlsaXR5LCBpdCBjcmVhdGVzIGludGVncml0eSBwcmVzc3VyZS4NCg0KIyMgSW50ZWdy",
    "aXR5LWRlZ3JhZGluZyBjaGFuZ2UNCg0KYGBgdGV4dA0KQWRkIHBhcmFsbGVsIGRvY3VtZW50YXRp",
    "b24NCndpdGhvdXQgaWRlbnRpdHksIHByb3ZlbmFuY2UsIG9yIGRyaWZ0IGNoZWNrcy4NCmBgYA0K",
    "DQpJdCBtYXkgbG9vayBwcm9kdWN0aXZlLCBidXQgaXQgY3JlYXRlcyBhIHNlY29uZCB0cnV0aCBz",
    "dXJmYWNlLg0KDQpUaGF0IGxvd2VycyBpbnRlZ3JpdHkuDQoNCi0tLQ0KDQojIENvc3QgYmVsb25n",
    "cyBpbiB0aGUgaW50ZWdyaXR5IGVxdWF0aW9uDQoNCllvdXIgbWFpbnRlbmFuY2UgcG9pbnQgaXMg",
    "aW1wb3J0YW50Lg0KDQpJbnRlZ3JpdHkgaXMgbm90IG9ubHkgY29ycmVjdG5lc3MuIEl0IGFsc28g",
    "aW5jbHVkZXMgdGhlIHN5c3RlbeKAmXMgYWJpbGl0eSB0byByZW1haW4gY29ycmVjdCBvdmVyIHRp",
    "bWUuDQoNCmBgYHRleHQNCk1vcmUgYXJ0aWZhY3RzDQorDQptb3JlIGluZGVwZW5kZW50IGludGVy",
    "cHJldGF0aW9uDQorDQptb3JlIG1hbnVhbCBzeW5jaHJvbml6YXRpb24NCisNCm1vcmUgdW5wcm92",
    "ZW4gbWFpbnRlbmFuY2UNCj0NCm1vcmUgZHJpZnQgb3Bwb3J0dW5pdGllcw0KYGBgDQoNClNvOg0K",
    "DQpgYGB0ZXh0DQpNYWludGVuYW5jZSBjb3N0DQp3aXRob3V0IHByb3BvcnRpb25hbCBpbnRlZ3Jp",
    "dHkgZ2Fpbg0KICAgIOKGkw0KZ3JlYXRlciBmdXR1cmUgZHJpZnQgc3VyZmFjZQ0KICAgIOKGkw0K",
    "bG93ZXIgbGlmZWN5Y2xlIGludGVncml0eQ0KYGBgDQoNClRoaXMgZG9lcyBub3QgbWVhbiBtYWlu",
    "dGVuYW5jZSBoYXMgbm8gdmFsdWUuIEl0IG1lYW5zIG1haW50ZW5hbmNlIG11c3QgaGF2ZSBhIGRl",
    "Y2xhcmVkIHB1cnBvc2UuDQoNCkZvciBleGFtcGxlOg0KDQpgYGB0ZXh0DQpNYWludGVuYW5jZSBh",
    "Y3Rpb246DQpSZXBsYWNlIGFuIHVuc3VwcG9ydGVkIHBhcnNlciBkZXBlbmRlbmN5Lg0KDQpJbnRl",
    "Z3JpdHkgZ2FpbjoNClByZXNlcnZlcyBkZXRlcm1pbmlzdGljIHBhcnNpbmcgdW5kZXIgc3VwcG9y",
    "dGVkIHJ1bnRpbWVzLg0KDQpOb24tZGVncmFkYXRpb24gZ3VhcmQ6DQpEdXBsaWNhdGUtbWVtYmVy",
    "IGRldGVjdGlvbiBhbmQgZXhhY3QtYnl0ZSB0ZXN0aW1vbnkgcmVtYWluIHVuY2hhbmdlZC4NCmBg",
    "YA0KDQpUaGF0IGlzIGxlZ2l0aW1hdGUgbWFpbnRlbmFuY2UgYmVjYXVzZSBpdCBwcmVzZXJ2ZXMg",
    "YW4gZXN0YWJsaXNoZWQgZ3VhcmFudGVlLg0KDQpCdXQ6DQoNCmBgYHRleHQNCk1haW50ZW5hbmNl",
    "IGFjdGlvbjoNClJld3JpdGUgd29ya2luZyBjb2RlIGJlY2F1c2UgYSBkaWZmZXJlbnQgc3R5bGUg",
    "bG9va3MgbmljZXIuDQoNCkludGVncml0eSBnYWluOg0KTm9uZSBlc3RhYmxpc2hlZC4NCmBgYA0K",
    "DQpUaGF0IHNob3VsZCBub3QgYXV0b21hdGljYWxseSBlbnRlciB0aGUgc3lzdGVtLg0KDQotLS0N",
    "Cg0KIyBEb2N1bWVudGF0aW9uIGlzIHBhcnQgb2YgcHJvb2YNCg0KVGhpcyBpcyB0aGUgbmV4dCBt",
    "YWpvciBwcmluY2lwbGU6DQoNCj4gKipEb2N1bWVudGF0aW9uIGlzIG5vdCBjb21tZW50YXJ5IHN1",
    "cnJvdW5kaW5nIHByb29mLiBQcm9wZXJseSBnb3Zlcm5lZCBkb2N1bWVudGF0aW9uIGlzIHBhcnQg",
    "b2YgdGhlIHByb29mIGNoYWluLioqDQoNCkEgZG9jdW1lbnQgc2hvdWxkIGJlIGFibGUgdG8gYW5z",
    "d2VyOg0KDQpgYGB0ZXh0DQpXaGF0IGNsYWltIGlzIGJlaW5nIG1hZGU/DQoNCldoaWNoIGludGVu",
    "dCBhdXRob3JpemVkIHRoYXQgY2xhaW0/DQoNCldoaWNoIHNvdXJjZSBtYXRlcmlhbCBzdXBwb3J0",
    "cyBpdD8NCg0KV2hpY2ggc2VjdGlvbiBvZiB0aGF0IHNvdXJjZSB3YXMgdXNlZD8NCg0KV2hpY2gg",
    "dHJhbnNmb3JtYXRpb24gcHJvZHVjZWQgdGhpcyB3b3JkaW5nPw0KDQpXaGljaCB2ZXJzaW9uIG9m",
    "IHRoZSBzb3VyY2Ugd2FzIHByZXNlbnQ/DQoNCkhhcyBlaXRoZXIgdGhlIHNvdXJjZSBvciB0aGUg",
    "cHJvamVjdGlvbiBjaGFuZ2VkPw0KYGBgDQoNClRoZSBkb2N1bWVudGF0aW9uIGNoYWluIGJlY29t",
    "ZXM6DQoNCmBgYHRleHQNCkNvbnZlcnNhdGlvbiBvciBzb3VyY2UgYXJ0aWZhY3QNCiAgICDihpMN",
    "CnN0YWJsZSBzb3VyY2UgaWRlbnRpdHkNCiAgICDihpMNCmV4YWN0IHNlY3Rpb24gb3IgcmFuZ2UN",
    "CiAgICDihpMNCnNvdXJjZSBjb250ZW50IGRpZ2VzdA0KICAgIOKGkw0KYWRtaXR0ZWQgYW5hbHlz",
    "aXMNCiAgICDihpMNCmRvY3VtZW50IHByb2plY3Rpb24NCiAgICDihpMNCmRvY3VtZW50IGRpZ2Vz",
    "dA0KICAgIOKGkw0KcHVibGljIHRlYWNoaW5nIGFydGlmYWN0DQpgYGANCg0KTm93IHRoZSBjb3Vy",
    "c2UgbWF0ZXJpYWwgaXMgbm90IG1lcmVseSBpbnNwaXJlZCBieSBhIGNvbnZlcnNhdGlvbi4NCg0K",
    "SXQgaXMgYSB0cmFjZWFibGUgcHJvamVjdGlvbiBvZiBpZGVudGlmaWVkIGF1dGhvcml0eS4NCg0K",
    "LS0tDQoNCiMgQ29udmVyc2F0aW9uLWRlcml2ZWQgYXV0aG9yaXR5IG5lZWRzIGZpcnN0LWNsYXNz",
    "IGlkZW50aXR5DQoNClRoaXMgaXMgZXhhY3RseSByaWdodDoNCg0KPiBBbnkgZHVyYWJsZSBkb2N1",
    "bWVudCBwcm9kdWNlZCBmcm9tIGEgY29udmVyc2F0aW9uIG5lZWRzIGlkZW50aXR5LCBsb2NhdGlv",
    "biwgYW5kIGhhc2ggc3RhYmlsaXR5Lg0KDQpBIGNvbnZlcnNhdGlvbi1kZXJpdmVkIHNvdXJjZSBy",
    "ZWZlcmVuY2Ugc2hvdWxkIGNvbmNlcHR1YWxseSBpbmNsdWRlOg0KDQpgYGBqc29uDQp7DQogICJz",
    "b3VyY2VSZWZlcmVuY2VUeXBlIjogImNvbnZlcnNhdGlvbi1zb3VyY2UtcmVmZXJlbmNlLnYxIiwN",
    "CiAgImNvbnZlcnNhdGlvbklkIjogImNvbnZlcnNhdGlvbi0uLi4iLA0KICAibWVzc2FnZUlkIjog",
    "Im1lc3NhZ2UtLi4uIiwNCiAgInNwZWFrZXIiOiAidXNlciIsDQogICJjYXB0dXJlZEF0IjogIjIw",
    "MjYtMDctMjdULi4uIiwNCiAgImNvbnRlbnREaWdlc3QiOiAic2hhMjU2Oi4uLiIsDQogICJzZWxl",
    "Y3Rpb24iOiB7DQogICAgImtpbmQiOiAiY2hhcmFjdGVyLXJhbmdlIiwNCiAgICAic3RhcnQiOiAw",
    "LA0KICAgICJlbmQiOiA4NDINCiAgfSwNCiAgInNlbGVjdGlvbkRpZ2VzdCI6ICJzaGEyNTY6Li4u",
    "Ig0KfQ0KYGBgDQoNCkEgZGVyaXZlZCBkb2N1bWVudGF0aW9uIHNlY3Rpb24gY291bGQgdGhlbiBk",
    "ZWNsYXJlOg0KDQpgYGBqc29uDQp7DQogICJkb2N1bWVudFNlY3Rpb25JZCI6ICJjbG9zZWQtY2ly",
    "Y3VpdC1vZi1pbnRlbnQiLA0KICAic291cmNlUmVmZXJlbmNlcyI6IFsNCiAgICB7DQogICAgICAi",
    "Y29udmVyc2F0aW9uSWQiOiAiY29udmVyc2F0aW9uLS4uLiIsDQogICAgICAibWVzc2FnZUlkIjog",
    "Im1lc3NhZ2UtLi4uIiwNCiAgICAgICJzZWxlY3Rpb25EaWdlc3QiOiAic2hhMjU2Oi4uLiINCiAg",